{
  "schema_version": 1,
  "task_id": "cleanup-essentials",
  "gate": "controlled_host_research_review",
  "status": "passed",
  "revision": "content:1da02999e5ab48da5f98b640d6262d3f313bb75bb2fdfe56ab789dacbdb1be5b",
  "timestamp": "2026-09-26T20:19:32.636899+00:00",
  "producer": "/root/simple_review",
  "client": "codex",
  "checks": [
    {
      "name": "Independent replay and fingerprints of isolated host controls; claims limited to research",
      "status": "passed"
    }
  ]
}
