{
  "$schema": "../../schemas/evidence.schema.json",
  "schema_version": 1,
  "task_id": "discovery-prototype",
  "gate": "plan_review",
  "status": "passed",
  "revision": "content:4fc26851b238ac0e0d8f422cc931e9b2be798122bde1020c2871641b814f62cb",
  "timestamp": "2026-09-24T23:16:40.426911+00:00",
  "producer": "specification-critic",
  "client": "codex",
  "checks": [
    {
      "name": "plan_review-report",
      "status": "passed",
      "measurement": {
        "report": ".workflow/evidence/discovery-prototype/plan-review.md",
        "sha256": "95d90f29eaa9def51cb45291cced8ea8d8d9dcbd457e63673848736fd556070e"
      }
    }
  ]
}
