{
  "schema_version": 1,
  "task_id": "cleanup-essentials",
  "gate": "date_storage_sqlite_control",
  "status": "passed",
  "revision": "content:82f9b611220f9388f226f6224a164144f338243ef939983a9edc2a5fcba55e92",
  "timestamp": "2026-09-26T23:17:52.757060+00:00",
  "producer": "codex /root",
  "client": "codex",
  "checks": [
    {
      "name": "Native SQLite separate-reader backup under writer reservation succeeded",
      "status": "passed"
    },
    {
      "name": "Competing connection write rejected while reservation held",
      "status": "passed"
    }
  ]
}
