{
  "$schema": "../../schemas/evidence.schema.json",
  "schema_version": 1,
  "task_id": "plugin-products",
  "gate": "automated_tests",
  "status": "passed",
  "revision": "content:2a5e5d3e8b8442a82e2a9d5d215654123e77234f1ef0cf48afd7e77170827bc1",
  "timestamp": "2026-09-25T19:10:10.057407+00:00",
  "producer": "scripts/run_check.py",
  "client": "automation",
  "checks": [
    {
      "name": "integration-tests",
      "status": "passed",
      "command": "[\"python3\", \"scripts/probe_smoke.py\"]",
      "exit_code": 0,
      "log": ".workflow/evidence/plugin-products/logs/integration-tests.log"
    },
    {
      "name": "template-integrity",
      "status": "passed",
      "command": "[\"python3\", \"scripts/template_self_test.py\"]",
      "exit_code": 0,
      "log": ".workflow/evidence/plugin-products/logs/template-integrity.log"
    },
    {
      "name": "adapter-integrity",
      "status": "passed",
      "command": "[\"python3\", \"scripts/sync_agent_adapters.py\", \"--check\"]",
      "exit_code": 0,
      "log": ".workflow/evidence/plugin-products/logs/adapter-integrity.log"
    },
    {
      "name": "catalog-state",
      "status": "passed",
      "command": "[\"python3\", \"scripts/catalog_state_check.py\"]",
      "exit_code": 0,
      "log": ".workflow/evidence/plugin-products/logs/catalog-state.log"
    }
  ]
}
