{
  "schema_version": 1,
  "task_id": "cleanup-essentials",
  "gate": "receipt_source_review",
  "status": "passed",
  "revision": "content:77344710cc095f2ed6d9908de868718a72d078bfa33ec0013e3032d200994c70",
  "timestamp": "2026-09-26T23:33:54.781781+00:00",
  "producer": "codex /root/container_review",
  "client": "codex",
  "checks": [
    {
      "name": "Fresh source review passed; controlled invalid receipt CLI test reaches pkgutil",
      "status": "passed"
    },
    {
      "name": "Final CLI argument/inspection/output exit status contract reviewed and passed",
      "status": "passed"
    }
  ]
}
