{
  "schema_version": 1,
  "task_id": "cleanup-essentials",
  "gate": "four_host_descriptor_review",
  "status": "passed",
  "revision": "content:1da02999e5ab48da5f98b640d6262d3f313bb75bb2fdfe56ab789dacbdb1be5b",
  "timestamp": "2026-09-26T19:47:28.906150+00:00",
  "producer": "/root/simple_review",
  "client": "codex",
  "checks": [
    {
      "name": "Independent source review of strict Live12 candidate extraction, persisted unknown usage and collision boundaries",
      "status": "passed"
    }
  ]
}
