{
  "$schema": "../../schemas/evidence.schema.json",
  "schema_version": 1,
  "task_id": "plugin-products",
  "gate": "ux_review",
  "status": "passed",
  "revision": "content:2a5e5d3e8b8442a82e2a9d5d215654123e77234f1ef0cf48afd7e77170827bc1",
  "timestamp": "2026-09-25T19:10:35.846560+00:00",
  "producer": "ux-reviewer",
  "client": "codex",
  "checks": [
    {
      "name": "ux_review-report",
      "status": "passed",
      "measurement": {
        "report": ".workflow/evidence/plugin-products/native-ui-review-report.json",
        "sha256": "23495acb42d00fc4fd9bde6a1f05b691d8b0e02b4fb4fa2ae5fb03782484f078"
      }
    }
  ]
}
