{
  "$schema": "../../schemas/evidence.schema.json",
  "schema_version": 1,
  "task_id": "persistent-catalog",
  "gate": "runtime_tests",
  "status": "passed",
  "revision": "content:1b467370a5aa3089ac6e1240d23b285dc0acb57fa14f162e8acd4ca6a5078fe2",
  "timestamp": "2026-09-26T00:04:48.880953+00:00",
  "producer": "scripts/run_check.py",
  "client": "automation",
  "checks": [
    {
      "name": "build-release",
      "status": "passed",
      "command": "[\"swift\", \"build\", \"-c\", \"release\"]",
      "exit_code": 0,
      "log": ".workflow/evidence/persistent-catalog/logs/build-release.log"
    },
    {
      "name": "app-package",
      "status": "passed",
      "command": "[\"python3\", \"scripts/build_app.py\"]",
      "exit_code": 0,
      "log": ".workflow/evidence/persistent-catalog/logs/app-package.log"
    },
    {
      "name": "catalog-runtime",
      "status": "passed",
      "command": "[\"build/Simplify.app/Contents/MacOS/Simplify\", \"--ui-smoke\", \"captures/catalog\"]",
      "exit_code": 0,
      "log": ".workflow/evidence/persistent-catalog/logs/catalog-runtime.log"
    }
  ]
}
